{
  "$schema": "https://json-schema.org/draft/2020-12/schema",
  "$id": "https://obsidian-kdb.local/schemas/compile_result.schema.json",
  "title": "KDB Compile Result (page-intents model)",
  "description": "Aggregate LLM output across all sources in a compile run. The LLM emits semantic intent only: slugs, titles, bodies, logical links. Python owns paths, frontmatter, timestamps, versions, incoming-link reconciliation. See docs/CODEBASE_OVERVIEW.md D8 and KDB/KDB-Compiler-System-Prompt.md.",
  "type": "object",
  "additionalProperties": false,
  "required": ["run_id", "success", "compiled_sources"],
  "properties": {
    "run_id": {
      "type": "string",
      "minLength": 1,
      "description": "Stamped by Python (run_context.py). LLM does not emit run_ids."
    },
    "success": { "type": "boolean" },
    "compiled_sources": {
      "type": "array",
      "items": { "$ref": "#/$defs/compiledSource" }
    },
    "log_entries": {
      "type": "array",
      "description": "LLM-emitted log items (contradictions, ambiguities, low-confidence decisions). Persisted in state/runs/<run_id>.json journal.",
      "items": { "$ref": "#/$defs/logEntry" }
    },
    "errors": {
      "type": "array",
      "items": { "type": "string" }
    },
    "warnings": {
      "type": "array",
      "items": { "type": "string" }
    },
    "canonical_meta": {
      "$ref": "#/$defs/canonicalMeta",
      "description": "Stage 6 (canonicalize) output (#74). Absent on raw extraction (pre-Stage 6); present post-Stage 6. Optional per D-R5-7 so the same schema validates both pre- and post-canonicalized payloads."
    }
  },
  "$defs": {
    "slug": {
      "type": "string",
      "description": "Lowercase ASCII kebab-case identifier. No paths, no .md suffixes, no directory separators. The 'summary-' prefix is reserved (see summarySlug).",
      "pattern": "^[a-z0-9]+(?:-[a-z0-9]+)*$",
      "minLength": 1,
      "maxLength": 120
    },
    "summarySlug": {
      "type": "string",
      "description": "Slug for the per-source summary page. MUST start with the reserved 'summary-' prefix followed by the kebab-cased source filename stem.",
      "pattern": "^summary-[a-z0-9]+(?:-[a-z0-9]+)*$",
      "minLength": 9,
      "maxLength": 120
    },
    "sourceId": {
      "type": "string",
      "description": "Canonical relative path of a raw source (set by Python; the LLM echoes back the one it was given).",
      "pattern": "^KDB/raw/.+",
      "minLength": 1
    },
    "pageType": {
      "type": "string",
      "enum": ["summary", "concept", "article"],
      "description": "Only LLM-authored page types. Index and log are Python-authored and not emittable by the LLM."
    },
    "pageStatus": {
      "type": "string",
      "enum": ["active", "stale", "archived"]
    },
    "confidence": {
      "type": "string",
      "enum": ["low", "medium", "high"]
    },
    "pageIntent": {
      "type": "object",
      "description": "One page the LLM wants to create or replace. Full-body replacement model (D18).",
      "additionalProperties": false,
      "required": ["slug", "page_type", "title", "body"],
      "properties": {
        "slug": { "$ref": "#/$defs/slug" },
        "page_type": { "$ref": "#/$defs/pageType" },
        "title": { "type": "string", "minLength": 1, "maxLength": 200 },
        "status": { "$ref": "#/$defs/pageStatus" },
        "body": {
          "type": "string",
          "description": "Full markdown body, no frontmatter. Python prepends frontmatter during apply."
        },
        "supports_page_existence": {
          "type": "array",
          "description": "source_ids that justify this page existing. Must reference real sources (current or manifest-known).",
          "items": { "$ref": "#/$defs/sourceId" }
        },
        "outgoing_links": {
          "type": "array",
          "description": "Slugs this page's body links to. Must appear in body as [[slug]]. Python reconciles incoming_links_known from these.",
          "items": { "$ref": "#/$defs/slug" }
        },
        "confidence": { "$ref": "#/$defs/confidence" },
        "canonical_id": {
          "type": ["string", "null"],
          "description": "Stage 6 (canonicalize) output (#74). NULL means this page is canonical; a non-null slug means this page is an alias of the referenced canonical (D-R5-5). Optional per D-R5-7 — absent on raw extraction; populated post-Stage 6."
        },
        "domain": {
          "oneOf": [
            { "type": "string", "minLength": 1 },
            { "type": "array", "items": { "type": "string", "minLength": 1 }, "minItems": 1, "maxItems": 5 },
            { "type": "null" }
          ],
          "description": "Knowledge domain(s) for this page. Omit or null when unknown. Max 5 items if array. Python normalises to kebab-case at ingest."
        },
        "sub_domain": {
          "oneOf": [
            { "type": "string", "minLength": 1 },
            { "type": "null" }
          ],
          "description": "Narrower label within the primary domain. Valid only when domain is a single string; omitted (null) when domain is an array or absent."
        }
      }
    },
    "logEntry": {
      "type": "object",
      "additionalProperties": false,
      "required": ["level", "message"],
      "properties": {
        "level": {
          "type": "string",
          "enum": ["info", "notice", "contradiction", "warning"]
        },
        "message": { "type": "string", "minLength": 1 },
        "related_slugs": {
          "type": "array",
          "items": { "$ref": "#/$defs/slug" }
        },
        "related_source_ids": {
          "type": "array",
          "items": { "$ref": "#/$defs/sourceId" }
        }
      }
    },
    "compiledSource": {
      "type": "object",
      "description": "Output for one source file.",
      "additionalProperties": false,
      "required": ["source_id", "summary_slug", "pages"],
      "properties": {
        "source_id": { "$ref": "#/$defs/sourceId" },
        "summary_slug": { "$ref": "#/$defs/summarySlug" },
        "concept_slugs": {
          "type": "array",
          "items": { "$ref": "#/$defs/slug" }
        },
        "article_slugs": {
          "type": "array",
          "items": { "$ref": "#/$defs/slug" }
        },
        "pages": {
          "type": "array",
          "description": "Every page the LLM wants to create or replace on behalf of this source (summary + concepts + articles).",
          "items": { "$ref": "#/$defs/pageIntent" },
          "minItems": 1
        },
        "compile_meta": {
          "type": "object",
          "description": "Per-source model-call metadata stamped by Python. Present only when this entry came from a live compile; omitted for fixture-backed compile_result.json. Optional at this level so M1.7 fixture tests remain valid.",
          "additionalProperties": false,
          "required": ["provider", "model", "input_tokens", "output_tokens", "latency_ms", "attempts", "ok"],
          "properties": {
            "provider": { "type": "string" },
            "model": { "type": "string" },
            "input_tokens": { "type": "integer", "minimum": 0 },
            "output_tokens": { "type": "integer", "minimum": 0 },
            "latency_ms": { "type": "integer", "minimum": 0 },
            "attempts": { "type": "integer", "minimum": 1 },
            "ok": { "type": "boolean" },
            "error": { "type": ["string", "null"] }
          }
        },
        "source_meta": {
          "type": "object",
          "description": "Pass-1 frontmatter projection (D-89-17 amended by D-89-19/D-89-20, v0.2.2). Omitted when Pass-1 enrichment has not run for this source. Ingestor writes summary/author/domain/source_type to Source node. The `summary` field carries the Pass-1 verbatim summary with key_themes mechanically appended per D-89-19. key_entities + key_themes are no longer threaded to Pass-2 separately (D-89-20 — themes participate in the graph via entity_search_keys → context_loader T2-rewrite, upstream of Pass-2).",
          "additionalProperties": false,
          "required": ["summary", "author", "domain", "source_type"],
          "properties": {
            "summary": { "type": "string" },
            "author": { "type": ["string", "null"] },
            "domain": { "type": "string" },
            "source_type": { "type": "string" }
          }
        }
      }
    },
    "canonicalMeta": {
      "type": "object",
      "additionalProperties": false,
      "description": "Stage 6 canonicalization output (#74). Records every alias resolution, link remap, and page merge that happened so `graphdb-kdb rebuild` can reconstruct the same state from this run's sidecar.",
      "required": ["algorithm_version", "ledger_snapshot_sha256", "aliases_emitted", "outgoing_link_remaps", "merged_pages"],
      "properties": {
        "algorithm_version": {
          "type": "string",
          "minLength": 1,
          "description": "Version of the canonicalize algorithm. Bumps when the algorithm changes in a way that affects output; replay tolerates older versions iff backward-compatible."
        },
        "ledger_snapshot_sha256": {
          "type": "string",
          "minLength": 1,
          "description": "sha256 of the aliases.json bytes at compile time (D-R5-7). Sentinel 'empty' when the ledger was absent. Rebuild verifies this matches the current ledger before applying aliases."
        },
        "aliases_emitted": {
          "type": "array",
          "description": "Aliases actually used in this run (resolved from a page-slug, outgoing_link, or body wikilink position). Drives graph_sync alias-Entity row creation in #74.5.",
          "items": {
            "type": "object",
            "additionalProperties": false,
            "required": ["alias_slug", "canonical_slug", "algorithm"],
            "properties": {
              "alias_slug": { "$ref": "#/$defs/slug" },
              "canonical_slug": { "$ref": "#/$defs/slug" },
              "algorithm": {
                "type": "string",
                "enum": ["ledger", "string_norm", "embedding", "llm_judge"],
                "description": "Mechanism that produced this alias mapping. v1 emits 'ledger' only; v2 gates add 'embedding' and 'llm_judge'."
              }
            }
          }
        },
        "outgoing_link_remaps": {
          "type": "array",
          "description": "Deduped (from, to) pairs of every link-position remap (outgoing_links metadata + body [[wikilink]] tokens).",
          "items": {
            "type": "object",
            "additionalProperties": false,
            "required": ["from", "to"],
            "properties": {
              "from": { "type": "string", "minLength": 1 },
              "to": { "$ref": "#/$defs/slug" }
            }
          }
        },
        "merged_pages": {
          "type": "array",
          "description": "Per-merge log for OQ-F page-intent merges. One entry per alias page intent that was folded into a canonical.",
          "items": {
            "type": "object",
            "additionalProperties": false,
            "required": ["alias_page_slug", "merged_into_canonical", "merge_strategy"],
            "properties": {
              "alias_page_slug": { "type": "string", "minLength": 1 },
              "merged_into_canonical": { "$ref": "#/$defs/slug" },
              "merge_strategy": {
                "type": "string",
                "enum": ["alias-singleton-rename", "canonical-wins", "longest-wins"]
              }
            }
          }
        }
      }
    }
  }
}
